{
  "$schema": "./schemas/structure-schema.json",
  "version": "1.0.0",
  "generated_at": "2024-01-15T10:30:00Z",

  "root": "/path/to/project",

  "tree": {
    "src": {
      "type": "directory",
      "purpose": "Main source code",
      "children": {
        "app": {
          "type": "directory",
          "purpose": "Next.js App Router pages",
          "framework": "nextjs",
          "children": {
            "api": {
              "type": "directory",
              "purpose": "API routes",
              "pattern": "api-routes"
            },
            "layout.tsx": {
              "type": "file",
              "purpose": "Root layout"
            },
            "page.tsx": {
              "type": "file",
              "purpose": "Home page"
            }
          }
        },
        "components": {
          "type": "directory",
          "purpose": "Shared React components",
          "pattern": "component-library",
          "file_count": 24
        },
        "hooks": {
          "type": "directory",
          "purpose": "Custom React hooks",
          "pattern": "custom-hooks",
          "file_count": 8
        },
        "services": {
          "type": "directory",
          "purpose": "API and business logic",
          "pattern": "service-layer",
          "file_count": 6
        },
        "stores": {
          "type": "directory",
          "purpose": "Zustand state stores",
          "pattern": "state-management",
          "file_count": 4
        },
        "types": {
          "type": "directory",
          "purpose": "TypeScript type definitions",
          "file_count": 12
        },
        "utils": {
          "type": "directory",
          "purpose": "Utility functions",
          "file_count": 10
        }
      }
    },
    "tests": {
      "type": "directory",
      "purpose": "Test files",
      "pattern": "colocated-tests",
      "children": {
        "unit": { "type": "directory", "file_count": 45 },
        "integration": { "type": "directory", "file_count": 12 },
        "e2e": { "type": "directory", "file_count": 8 }
      }
    },
    "public": {
      "type": "directory",
      "purpose": "Static assets"
    },
    "prisma": {
      "type": "directory",
      "purpose": "Database schema and migrations",
      "pattern": "prisma-orm"
    }
  },

  "statistics": {
    "total_directories": 32,
    "total_files": 189,
    "by_extension": {
      ".tsx": 78,
      ".ts": 65,
      ".json": 12,
      ".css": 8,
      ".md": 15,
      "other": 11
    }
  },

  "framework_detection": {
    "primary": "nextjs",
    "version": "14",
    "router": "app",
    "additional": ["react", "typescript", "tailwind", "prisma"]
  }
}
